PMID,pubmed_id,title,keywords,journal,abstract,conclusions,results
[31675391],31675391,Smartphone applications for the treatment of depressive symptoms: A meta-analysis and qualitative review.,[],Annals of clinical psychiatry : official journal of the American Academy of Clinical Psychiatrists,"Emerging research indicates that the use of smartphone mental health applications (apps) could be used as an adjunctive therapy for individuals with depression, especially those who have difficulty accessing conventional therapies. The adoption and ownership of smartphone technology continues to increase in developed and developing nations, and could provide widespread and cost-effective evidence-based treatments for depressive symptoms.
The primary objective of this meta-analysis was to quantitatively evaluate the effects of smartphone mental health app interventions on depressive symptoms. Identified studies were qualitatively reviewed to address the following secondary objectives: (1) identify the types of smartphone apps currently being used to target depression; (2) identify factors associated with positive response to smartphone apps in depression; (3) provide directives for future research and app development; and (4) characterize the therapeutic opportunity of smartphone app interventions among individuals with depression.
The results indicate that there may be some therapeutic opportunity with smartphone interventions as an adjunctive treatment for depression. In particular, we observed a small effect in favor of smartphone app interventions for reducing depressive symptoms. However, because of the significant heterogeneity across studies, continued research among more homogenous samples is warranted to determine whether these interventions might have larger (ie, more clinically relevant) effects in specific subpopulations and/or whether specific app characteristics produce larger effects.
The current study highlights some key areas of priority going forward, particularly concerning the design of future studies and the development of novel technologies with a user-centered focus.",,"The results indicate that there may be some therapeutic opportunity with smartphone interventions as an adjunctive treatment for depression. In particular, we observed a small effect in favor of smartphone app interventions for reducing depressive symptoms. However, because of the significant heterogeneity across studies, continued research among more homogenous samples is warranted to determine whether these interventions might have larger (ie, more clinically relevant) effects in specific subpopulations and/or whether specific app characteristics produce larger effects."
[33190432],33190432,Physiotherapy and rehabilitation applications in lipedema management: A literature review.,"['complex\ndecongestive therapy', 'lipedema', 'literature review', 'physiotherapy and rehabilitation', 'walk training']",Lymphology,"Lipedema is a chronic and progressive disease of adipose tissue caused by abnormal fat accumulation in subcutaneous tissue. Although there is no known cure for lipedema, possible complications can be prevented with conservative and surgical treatments. One of the conservative treatment options is physiotherapy and rehabilitation (PR). When the literature is examined, few studies focusing on the efficacy of PR were found for this patient group. The purpose of this review is to provide a better understanding of the effectiveness of PR applications by compiling existing studies. A bibliographic PubMed search was performed for published studies regarding PR in lipedema management in June 2019 including the last 58 years (1951-2019). Articles were chosen by reading the abstracts and subsequently data were analyzed by reading the entire text through full-text resources. A total of 15 studies met inclusion criteria. Results document how lipedema patients are benefited by PR and the effectiveness of different types of PR programs. The current review also showed that complex decongestive physiotherapy, gait training, hydrotherapy, aerobic exercise, and resistance exercise training each have value in the management of lipedema. The effects of PR for the treatment of lipedema are variable among studies, although overall PR seems to be effective in lipedema management. Although physiotherapy applications have a potentially important role in the management of lipedema, they should be used in combination with other treatment modalities. More studies with higher quality are needed to fully demonstrate the effect and efficacy of PR in lipedema patients.",,
[29283056],29283056,Drug-Coated Balloons: Technologies and Clinical Applications.,"['Drug-eluting balloon', 'coronary artery disease', 'drug-coated balloon', 'paclitaxel', 'peripheral interventions', 'restenosis.']",Current pharmaceutical design,"The progress and development of drug-coated balloons (DCBs) represents an emerging alternative treatment in peripheral and coronary artery diseases, particularly when a non-stent approach is necessary. Several studies and meta-analyses have evaluated the clinical outcomes of DCBs in different lesions and this review aims to compile the progress and updated clinical data of DCB strategy in both peripheral artery diseases (PAD) and coronary artery diseases (CAD). The review highlights that clinical data has encouraged the use of DCB for applications in PAD and in the treatment of coronary in-stent restenosis (ISR). The employment of DCB in side branch treatment of bifurcation lesions has been reported to be feasible and safe, with good angiographic and clinical outcome. The use of DCB for arteriovenous fistula and grafts stenoses is a promising strategy, but more clinical data is required to draw reliable conclusions. The limitations and impact of the current generation of DCBs will be discussed and the clinical development of newer generation of the device is also covered in this review.",,
[32095826],32095826,A survey of gene expression meta-analysis: methods and applications.,"['biomarker discovery', 'data integration', 'gene expression', 'meta-analysis', 'omics data', 'public tools']",Briefings in bioinformatics,"The increasing use of high-throughput gene expression quantification technologies over the last two decades and the fact that most of the published studies are stored in public databases has triggered an explosion of studies available through public repositories. All this information offers an invaluable resource for reuse to generate new knowledge and scientific findings. In this context, great interest has been focused on meta-analysis methods to integrate and jointly analyze different gene expression datasets. In this work, we describe the main steps in the gene expression meta-analysis, from data preparation to the state-of-the art statistical methods. We also analyze the main types of applications and problems that can be approached in gene expression meta-analysis studies and provide a comparative overview of the available software and bioinformatics tools. Moreover, a practical guide for choosing the most appropriate method in each case is also provided.",,
[30675873],30675873,Vitamin D supplementation to prevent acute respiratory infections: individual participant data meta-analysis.,[],"Health technology assessment (Winchester, England)","Randomised controlled trials (RCTs) exploring the potential of vitamin D to prevent acute respiratory infections have yielded mixed results. Individual participant data (IPD) meta-analysis has the potential to identify factors that may explain this heterogeneity.
To assess the overall effect of vitamin D supplementation on the risk of acute respiratory infections (ARIs) and to identify factors modifying this effect.
MEDLINE, EMBASE, the Cochrane Central Register of Controlled Trials (CENTRAL), Web of Science, ClinicalTrials.gov and the International Standard Randomised Controlled Trials Number (ISRCTN) registry.
Randomised, double-blind, placebo-controlled trials of supplementation with vitamin D
Study quality was assessed using the Cochrane Collaboration Risk of Bias tool to assess sequence generation, allocation concealment, blinding of participants, personnel and outcome assessors, completeness of outcome data, evidence of selective outcome reporting and other potential threats to validity.
We identified 25 eligible RCTs (a total of 11,321 participants, aged from 0 to 95 years). IPD were obtained for 10,933 out of 11,321 (96.6%) participants. Vitamin D supplementation reduced the risk of ARI among all participants [adjusted odds ratio (aOR) 0.88, 95% confidence interval (CI) 0.81 to 0.96; heterogeneity 
Our study had limited power to detect the effects of vitamin D supplementation on the risk of upper versus lower respiratory infection, analysed separately.
Vitamin D supplementation was safe, and it protected against ARIs overall. Very deficient individuals and those not receiving bolus doses experienced the benefit. Incorporation of additional IPD from ongoing trials in the field has the potential to increase statistical power for analyses of secondary outcomes.
This study is registered as PROSPERO CRD42014013953.
The National Institute for Health Research Health Technology Assessment programme.",,"We identified 25 eligible RCTs (a total of 11,321 participants, aged from 0 to 95 years). IPD were obtained for 10,933 out of 11,321 (96.6%) participants. Vitamin D supplementation reduced the risk of ARI among all participants [adjusted odds ratio (aOR) 0.88, 95% confidence interval (CI) 0.81 to 0.96; heterogeneity "
[32781450],32781450,Combined Orthokeratology with Atropine for Children with Myopia: A Meta-Analysis.,"['Atropine', 'Axial length', 'Combination therapy', 'Myopia', 'Orthokeratology']",Ophthalmic research,"Myopia has become a worldwide public health issue, which is occurring at a younger age, leading to an increased risk of high myopia. Ocular complications associated with high myopia can lead to irreversible vision loss. It is urgent and critical to explore effective treatment to slow down or even stop the progression of myopia in young children.
The aim of the study was to evaluate the additive effects of orthokeratology (OK) and 0.01% atropine ophthalmic solution for myopia in children.
We searched PubMed, Cochrane Library, EMBASE, MEDLINE, Web of science, Ovid, EBSCO host, CNKI, and CBM to collect eligible studies. Efficacy and safety were evaluated in terms of the axial length (AL), uncorrected distant visual acuity (UCVA), corneal endothelial cell density (CECD), and intraocular pressure (IOP). We calculated the weighted mean difference (WMD) and the 95% confidence intervals (CIs) of all outcomes and plotted on forest plots.
Four studies were ultimately included, involving a total of 267 subjects. This meta-analysis revealed that the mean AL of the subjects in the experimental group was 0.09 mm less than that of subjects in the control group (WMD = -0.09, 95% CI [-0.15, -0.03], p = 0.003). There was no significant difference in UCVA, CECD, and IOP between the 2 groups (WMD was -0.01 [95% CI: -0.03, 0.01], 11.75 [95% CI: -4.09, 27.58], 0.12 [95% CI: -0.40, 0.63], respectively). None of the studies reported severe adverse events.
Our study suggests that the combination of OK and 0.01% atropine is more effective in slowing axial elongation than OK monotherapy in children with myopia in a relatively short duration of treatment. In addition, the combination therapy has no negative influence on UCVA, CECD, and IOP.","Our study suggests that the combination of OK and 0.01% atropine is more effective in slowing axial elongation than OK monotherapy in children with myopia in a relatively short duration of treatment. In addition, the combination therapy has no negative influence on UCVA, CECD, and IOP.","Four studies were ultimately included, involving a total of 267 subjects. This meta-analysis revealed that the mean AL of the subjects in the experimental group was 0.09 mm less than that of subjects in the control group (WMD = -0.09, 95% CI [-0.15, -0.03], p = 0.003). There was no significant difference in UCVA, CECD, and IOP between the 2 groups (WMD was -0.01 [95% CI: -0.03, 0.01], 11.75 [95% CI: -4.09, 27.58], 0.12 [95% CI: -0.40, 0.63], respectively). None of the studies reported severe adverse events."
[28872267],28872267,Psychological Pain in Suicidality: A Meta-Analysis.,[],The Journal of clinical psychiatry,"Perform a meta-analysis to quantify the association between psychological pain and current or lifetime history of suicidal ideation or suicide attempt.
Search MEDLINE, Web of Science, and PsycINFO from 1965 to 2015 for (psychache OR mental pain OR psychological pain) AND (suicid*).
Observational case-control studies addressing the difference in psychological pain between individuals with and without current or lifetime history of suicidal ideation or suicide attempt.
Data were independently extracted into a standard electronic form. All authors were contacted for unpublished data related to current or lifetime history of suicide ideation or attempt.
Twenty studies were included. Comparisons concerned 760 subjects with versus 8,803 subjects without lifetime history of suicide attempt; 344 subjects with versus 357 patients without current suicide attempt; 262 patients with versus 64 patients without lifetime history of suicidal ideation; and 551 subjects with versus 7,383 subjects without current suicidal ideation. The intensity of psychological pain was higher (1) in both subjects with lifetime history of suicide attempts and subjects with current suicide attempts versus without (effect sizes = 0.72, P < 10⁻² and 0.66, P < 10⁻², respectively) and (2) in both subjects with lifetime history of suicide ideation and subjects with current suicidal ideation versus without (effect sizes = 1.49, P = .01 and 1.15, P < 10⁻², respectively). Association between psychological pain and suicidality remained significant even when depression levels were not different between subjects.
Higher psychological pain levels are associated with suicidal ideation and acts. Considering psychological pain to be at the core of suicidality is important for daily clinical practice and for the promotion of innovative therapeutic strategies for suicide prevention.",,
[33372407],33372407,Risk factors of the severity of COVID-19: A meta-analysis.,[],International journal of clinical practice,"We intend to identify some probable risk factors that are responsible for the severity of COVID-19 using a meta-analysis.
The literature exploration lasted up to 18 April 2020 and through PubMed, Google Scholar, EMBASE and Cochrane Library we have identified 10 pertinent publications. To paraphrase the outcomes of autonomous researches, we have performed a random-effect meta-analysis.
A total of 2272 patients' information was extracted from the selected literature. We have found gender (male) (Risk ratio [RR] = 1.29, 95% Confidence Interval [CI] 1.07 to 1.54), hypertension (RR = 1.79, 95% CI 1.57 to 2.04), diabetes (RR = 1.57, 95% CI 1.25 to 1.98), fatigue or myalgia (RR = 1.17, 95% CI 1.02 to 1.35), and smoking history (RR = 1.71, 95% CI 1.25 to 2.35) are potential risk factors for the severity of COVID-19. We found fever (RR = 1.21, 95% CI 0.66 to 2.22), cough (1.13, 95% CI 0.98 to 1.30) and diarrhoea (RR = 1.14, 95% CI 0.93 to 1.40) as insignificant risk factors for COVID-19 severity.
The findings of this research may be beneficial to identify patients with higher risks to provide additional medical attention from the very beginning of the treatment.",,"A total of 2272 patients' information was extracted from the selected literature. We have found gender (male) (Risk ratio [RR] = 1.29, 95% Confidence Interval [CI] 1.07 to 1.54), hypertension (RR = 1.79, 95% CI 1.57 to 2.04), diabetes (RR = 1.57, 95% CI 1.25 to 1.98), fatigue or myalgia (RR = 1.17, 95% CI 1.02 to 1.35), and smoking history (RR = 1.71, 95% CI 1.25 to 2.35) are potential risk factors for the severity of COVID-19. We found fever (RR = 1.21, 95% CI 0.66 to 2.22), cough (1.13, 95% CI 0.98 to 1.30) and diarrhoea (RR = 1.14, 95% CI 0.93 to 1.40) as insignificant risk factors for COVID-19 severity."
[33397062],33397062,Meta-analysis of the Value of Cardiac Nuclear Magnetic Resonance in the Diagnosis of Viral Myocarditis.,[],Journal of the College of Physicians and Surgeons--Pakistan : JCPSP,"To evaluate the diagnostic value of cardiac magnetic resonance imaging (MRI) in viral myocarditis by meta-analysis. PubMed, EMbase, Cochrane, Web of Science, China National Knowledge Infrastructure (CNKI, China) Wanfang Databases were searched for clinical research literature on MRI diagnosis of viral myocarditis from the establishment of the database to March 1, 2020.The pooled sensitivity, specificity, positive likelihood ratio, negative likelihood ratio, diagnostic odds ratio (DOR) and the summary receiver operating characteristic (SROC) were analysed by Stata 15.0. Eight articles were included in the end. The results showed that the sensitivity, specificity, DOR, and area under the curve (AUC) SROCs were 94%, 75%, 45.24 and 0.88, respectively. Existing research have confirmed that cardiac MRI has high sensitivity (94%) and moderate specificity (75%) for viral myocarditis. The positive ratio of test in myocarditis group is 45.24 times higher than that in non-myocarditis group indicating the outstanding effect of diagnosis and discrimination. Key Words: Cardiac magnetic resonance imaging, Viral myocarditis, Systematic review, Meta-analysis.",,
[33285547],33285547,Cytokine Polymorphisms and Predisposition to Diabetic Nephropathy: A Meta-Analysis.,"['Diabetic nephropathy', 'Gene polymorphisms', 'Interleukin-1', 'Interleukin-18', 'Interleukin-4', 'Interleukin-8', 'Meta-analysis', 'Tumor necrosis factor-α']",International archives of allergy and immunology,"Cytokine polymorphismsmight influence the predisposition to diabetic nephropathy (DN), but the results of already published related studies are still controversial and ambiguous.
The authors designed this meta-analysis to more precisely estimate relationships between TNF-α/IL-1/IL-4/IL-8/IL-18polymorphisms and DN by pooling the results of already published related studies.
The authors searched Pubmed, Embase, Web of Science and CNKI for already published studies. Thirty already published studies were pooled and analyzed in this meta-analysis.
The overall pooled meta-analysis results showed that distributions of TNF-α -238 G/A, TNF-α -308 G/A, TNF-α -1031 C/T, IL-1A -889 C/T, IL-1B -511 C/Tand IL-18 -137 G/C polymorphisms among patients and controls differed significantly. Additionally, we also found that distributions of TNF-α -308 G/A, IL-1B -511 C/T and IL-18 -137 G/C polymorphisms among patients and controls from Asians differed significantly, and the distribution of the IL-1B -511 C/T polymorphism among patients and controls from Caucasians also differed significantly.
The meta-analysis results demonstrated that TNF-α -238 G/A, TNF-α -308 G/A, TNF-α -1031 C/T, IL-1A -889 C/T, IL-1B -511 C/Tand IL-18 -137 G/Cpolymorphisms might influence predisposition to DN in the overall pooled population. Moreover, TNF-α -308 G/A, IL-1B -511 C/T and IL-18 -137 G/C polymorphisms might influence predisposition to DN in Asians, whereas the IL-1B -511 C/T polymorphism might also influence predisposition to DN in Caucasians.","The meta-analysis results demonstrated that TNF-α -238 G/A, TNF-α -308 G/A, TNF-α -1031 C/T, IL-1A -889 C/T, IL-1B -511 C/Tand IL-18 -137 G/Cpolymorphisms might influence predisposition to DN in the overall pooled population. Moreover, TNF-α -308 G/A, IL-1B -511 C/T and IL-18 -137 G/C polymorphisms might influence predisposition to DN in Asians, whereas the IL-1B -511 C/T polymorphism might also influence predisposition to DN in Caucasians.","The overall pooled meta-analysis results showed that distributions of TNF-α -238 G/A, TNF-α -308 G/A, TNF-α -1031 C/T, IL-1A -889 C/T, IL-1B -511 C/Tand IL-18 -137 G/C polymorphisms among patients and controls differed significantly. Additionally, we also found that distributions of TNF-α -308 G/A, IL-1B -511 C/T and IL-18 -137 G/C polymorphisms among patients and controls from Asians differed significantly, and the distribution of the IL-1B -511 C/T polymorphism among patients and controls from Caucasians also differed significantly."
[18093299],18093299,The PRICE study (Protection Rest Ice Compression Elevation): design of a randomised controlled trial comparing standard versus cryokinetic ice applications in the management of acute ankle sprain [ISRCTN13903946].,[],BMC musculoskeletal disorders,"Cryotherapy (the application of ice for therapeutic purposes) is one of the most common treatment modalities employed in the immediate management of acute soft tissue injury. Despite its widespread clinical use, the precise physiological responses to therapeutic cooling have not been fully elucidated, and effective evidence-based treatment protocols are yet to be established. Intermittent ice applications are thought to exert a significant analgesic effect. This could facilitate earlier therapeutic exercise after injury, potentially allowing for a quicker return to activity. The primary aim of the forthcoming study is therefore to examine the safety and effectiveness of combining intermittent ice applications with periods of therapeutic exercise in the first week after an acute ankle sprain.
The study is a randomised controlled trial. 120 subjects with an acute grade I or grade II ankle sprain will be recruited from Accident & Emergency and a University based Sports Injury Clinic. Subjects will be randomised under strict double-blind conditions to either a standard cryotherapy (intermittent ice applications with compression) or cryokinetic treatment group (intermittent ice applications with compression and therapeutic exercise). After the first week, treatment will be standardised across groups. Assessor blinding will be maintained throughout the trial. Primary outcome will be function, assessed using the Lower Extremity Functional Scale (LEFS). Additional outcomes will include pain (10 cm Visual Analogue Scale), swelling (modified figure-of-eight method) and activity levels (activPALtrade mark physical activity monitor, PAL Technologies, Glasgow, UK). Diagnostic Ultrasound (Episcan-1-200 high frequency ultrasound scanning system, Longport International Ltd, PA) will also be used to assess the degree of soft tissue injury. After baseline assessment subjects will be followed up at 1, 2, 3 & 4 weeks post injury. All data will be analysed using repeated measures analysis of co-variance (ANCOVA).
This paper describes the rationale and design of a randomised controlled trial which will examine the effectiveness of two different cryotherapy protocols in the early management of acute ankle sprain.
ISRCTN13903946.",,
