PMID,pubmed_id,title,keywords,journal,abstract,conclusions,results
[32955554],32955554,Efficacy of Smartphone Applications for Smoking Cessation: A Randomized Clinical Trial.,[],JAMA internal medicine,"Smoking is a leading cause of premature death globally. Smartphone applications for smoking cessation are ubiquitous and address barriers to accessing traditional treatments, yet there is limited evidence for their efficacy.
To determine the efficacy of a smartphone application for smoking cessation based on acceptance and commitment therapy (ACT) vs a National Cancer Institute smoking cessation application based on US clinical practice guidelines (USCPG).
A 2-group, stratified, double-blind, individually randomized clinical trial was conducted from May 27, 2017, to September 28, 2018, among 2415 adult cigarette smokers (n = 1214 for the ACT-based smoking cessation application group and n = 1201 for the USCPG-based smoking cessation application group) with 3-, 6-, and 12-month postrandomization follow-up. The study was prespecified in the trial protocol. Follow-up data collection started on August 26, 2017, and ended at the last randomized participant's 12-month follow-up survey on December 23, 2019. Data were analyzed from February 25 to April 3, 2020. The primary analysis was performed on a complete-case basis, with intent-to-treat missing as smoking and multiple imputation sensitivity analyses.
iCanQuit, an ACT-based smoking cessation application, which taught acceptance of smoking triggers, and the National Cancer Institute QuitGuide, a USCPG-based smoking cessation application, which taught avoidance of smoking triggers.
The primary outcome was self-reported 30-day point prevalence abstinence (PPA) at 12 months after randomization. Secondary outcomes were 7-day PPA at 12 months after randomization, prolonged abstinence, 30-day and 7-day PPA at 3 and 6 months after randomization, missing data imputed with multiple imputation or coded as smoking, and cessation of all tobacco products (including e-cigarettes) at 12 months after randomization.
Participants were 2415 adult cigarette smokers (1700 women [70.4%]; 1666 White individuals [69.0%] and 868 racial/ethnic minorities [35.9%]; mean [SD] age at enrollment, 38.2 [10.9] years) from all 50 US states. The 3-month follow-up data retention rate was 86.7% (2093), the 6-month retention rate was 88.4% (2136), and the 12-month retention rate was 87.2% (2107). For the primary outcome of 30-day PPA at the 12-month follow-up, iCanQuit participants had 1.49 times higher odds of quitting smoking compared with QuitGuide participants (28.2% [293 of 1040] vs 21.1% [225 of 1067]; odds ratio [OR], 1.49; 95% CI, 1.22-1.83; P < .001). Effect sizes were very similar and statistically significant for 7-day PPA at the 12-month follow-up (OR, 1.35; 95% CI, 1.12-1.63; P = .002), prolonged abstinence at the 12-month follow-up (OR, 2.00; 95% CI, 1.45-2.76; P < .001), abstinence from all tobacco products (including e-cigarettes) at the 12-month follow-up (OR, 1.60; 95% CI, 1.28-1.99; P < .001), 30-day PPA at 3-month follow-up (OR, 2.20; 95% CI, 1.68-2.89; P < .001), 30-day PPA at 6-month follow-up (OR, 2.03; 95% CI, 1.63-2.54; P < .001), 7-day PPA at 3-month follow-up (OR, 2.04; 95% CI, 1.64-2.54; P < .001), and 7-day PPA at 6-month follow-up (OR, 1.73; 95% CI, 1.42-2.10; P < .001).
This trial provides evidence that, compared with a USCPG-based smartphone application, an ACT-based smartphone application was more efficacious for quitting cigarette smoking and thus can be an impactful treatment option.
ClinicalTrials.gov Identifier: NCT02724462.",,
[30826256],30826256,Mobile health applications enhance weight loss efficacy following bariatric surgery.,"['Bariatric surgery', 'Improved weight loss', 'Mobile health applications', 'mHealth']",Obesity research & clinical practice,"With the epidemic of obesity numerous mobile health (mHealth) applications have been designed with the goal of facilitating weight loss. This technology has the potential to focus behavioral modification in a manner that's effective for weight loss. We examined the use of this mHealth technology in our bariatric surgery population to evaluate effects on weight loss following surgery.
Single institution prospective randomized control trial performed at an academic center. 56 patients who recently underwent a laparoscopic sleeve gastrectomy (LSG) were enrolled into a control group with standard post-operative monitoring and a mHealth application group provided with iPad© minis with the MyFitnessPal© mHealth application. Participants were followed for 24 months. The primary outcomes were effect on weight loss as determined by excess body weight loss (%EWL) and excess BMI loss (%EBL).
Statistically significant differences in weight loss outcomes between the groups were present throughout the duration of the study. At 12 months, %EWL was 74.41% (control) vs 81.41% (mHealth) p value 0.047 and at 24 months, it was 59.10% (control) vs 71.47% (mHealth) p value 0.0078. %EBL findings at 12 months was 28.02% (control) vs 32.15% (mHealth) p value 0.0007 and at 24 months, it was 25.39% (control) vs 27.87% (mHealth) p value 0.048.
Our results demonstrate mHealth applications are a useful adjunct to improve and maintain weight loss following bariatric surgery. We suggest mHealth applications should be utilized following bariatric surgery for improved outcomes.",Our results demonstrate mHealth applications are a useful adjunct to improve and maintain weight loss following bariatric surgery. We suggest mHealth applications should be utilized following bariatric surgery for improved outcomes.,"Statistically significant differences in weight loss outcomes between the groups were present throughout the duration of the study. At 12 months, %EWL was 74.41% (control) vs 81.41% (mHealth) p value 0.047 and at 24 months, it was 59.10% (control) vs 71.47% (mHealth) p value 0.0078. %EBL findings at 12 months was 28.02% (control) vs 32.15% (mHealth) p value 0.0007 and at 24 months, it was 25.39% (control) vs 27.87% (mHealth) p value 0.048."
[16611722],16611722,Cryotherapy for acute ankle sprains: a randomised controlled study of two different icing protocols.,[],British journal of sports medicine,"The use of cryotherapy in the management of acute soft tissue injury is largely based on anecdotal evidence. Preliminary evidence suggests that intermittent cryotherapy applications are most effective at reducing tissue temperature to optimal therapeutic levels. However, its efficacy in treating injured human subjects is not yet known.
To compare the efficacy of an intermittent cryotherapy treatment protocol with a standard cryotherapy treatment protocol in the management of acute ankle sprains.
Sportsmen (n = 44) and members of the general public (n = 45) with mild/moderate acute ankle sprains.
Subjects were randomly allocated, under strictly controlled double blind conditions, to one of two treatment groups: standard ice application (n = 46) or intermittent ice application (n = 43). The mode of cryotherapy was standardised across groups and consisted of melting iced water (0 degrees C) in a standardised pack. Function, pain, and swelling were recorded at baseline and one, two, three, four, and six weeks after injury.
Subjects treated with the intermittent protocol had significantly (p<0.05) less ankle pain on activity than those using a standard 20 minute protocol; however, one week after ankle injury, there were no significant differences between groups in terms of function, swelling, or pain at rest.
Intermittent applications may enhance the therapeutic effect of ice in pain relief after acute soft tissue injury.",Intermittent applications may enhance the therapeutic effect of ice in pain relief after acute soft tissue injury.,"Subjects treated with the intermittent protocol had significantly (p<0.05) less ankle pain on activity than those using a standard 20 minute protocol; however, one week after ankle injury, there were no significant differences between groups in terms of function, swelling, or pain at rest."
[29420050],29420050,Happier Healers: Randomized Controlled Trial of Mobile Mindfulness for Stress Management.,"['medical students', 'meditation', 'mindfulness', 'mobile phone application']","Journal of alternative and complementary medicine (New York, N.Y.)","Medical students have higher rates of depression and psychologic distress than the general population, which may negatively impact academic performance and professional conduct. This study assessed whether 10-20 min of daily mindfulness meditation for 30 days, using a mobile phone application, could decrease perceived stress and improve well-being for medical students.
Eighty-eight medical students were stratified by class year and randomized to either intervention or control groups to use the mobile application Headspace, an audio-guided mindfulness meditation program, for 30 days. All participants completed the Perceived Stress Scale (PSS), Five-Facet Mindfulness Questionnaire (FFMQ), and General Well-Being Schedule (GWBS) at baseline (T1), 30 days (T2), and 60 days (T3). Repeated measures analysis of variance (rANOVA) was conducted for intervention versus control groups across T1, T2, and T3 to examine differences in stress, mindfulness, and well-being.
There was a significant interaction between time and treatment group for perceived stress and well-being. Perceived stress significantly decreased for the intervention group from T1 to T3 (F[2,142] = 3.98, p < 0.05). General well-being significantly increased for the intervention group compared to the control group from T1 to T2, and the increase was sustained through T3 (F[2,144] = 3.36, p < 0.05).
These results highlight that a mobile audio-guided mindfulness meditation program is an effective means to decrease perceived stress in medical students, which may have implications on patient care. Integrating mindfulness training into medical school curricula for management of school- and work-related stress may lead to fewer negative physician outcomes (e.g., burnout, anxiety, and depression) and improved physician and patient outcomes. This has implications for a broad group of therapists and healthcare providers, ultimately improving quality of healing and patient care.",,"There was a significant interaction between time and treatment group for perceived stress and well-being. Perceived stress significantly decreased for the intervention group from T1 to T3 (F[2,142] = 3.98, p < 0.05). General well-being significantly increased for the intervention group compared to the control group from T1 to T2, and the increase was sustained through T3 (F[2,144] = 3.36, p < 0.05)."
[33166594],33166594,Arresting early childhood caries using silver and fluoride products - A randomised trial.,"['Children', 'Early childhood caries', 'Remineralisation', 'Silver diamine fluoride', 'Silver nitrate', 'Sodium fluoride']",Journal of dentistry,"The aim of this randomised non-inferiority clinical trial was to compare the effectiveness of semi-annual (every six months) applications of 25 % silver nitrate (AgNO
Three-year-old children with active cavitated carious lesions were recruited and randomly assigned to two intervention groups. Children in Group A received semi-annual applications of 25 % AgNO
At baseline, 1,070 children were recruited, and 535 children were assigned to each group. After 30 months, the mean arrested ds in Groups A (n = 447) and B (n = 433) were 3.7 ± 3.6 and 3.6 ± 3.7, respectively (p = 0.694). The difference in the mean arrested ds between the two groups was 0.088 (95 % CI: -0.351 to 0.526).
Semi-annual application of 25 % AgNO
Silver and fluoride products are effective in arresting caries. As a simple, non-invasive, and inexpensive strategy, it can be used in young children, elderly adults, and people with special needs.",Semi-annual application of 25 % AgNO,"At baseline, 1,070 children were recruited, and 535 children were assigned to each group. After 30 months, the mean arrested ds in Groups A (n = 447) and B (n = 433) were 3.7 ± 3.6 and 3.6 ± 3.7, respectively (p = 0.694). The difference in the mean arrested ds between the two groups was 0.088 (95 % CI: -0.351 to 0.526)."
[31580698],31580698,Does the Application of Tecar Therapy Affect Temperature and Perfusion of Skin and Muscle Microcirculation? A Pilot Feasibility Study on Healthy Subjects.,"['diathermy', 'laser speckle contrast imaging', 'perfusion imaging', 'physical therapy modality', 'regional blood flow', 'skin temperature']","Journal of alternative and complementary medicine (New York, N.Y.)",,,
[30756393],30756393,Shorter cryoballoon applications times do effect efficacy but result in less phrenic nerve injury: Results of the randomized 123 study.,"['atrial fibrillation', 'cryoballoon', 'phrenic nerve injury', 'pulmonary vein isolation', 'safety']",Pacing and clinical electrophysiology : PACE,"The second-generation cryoballoon significantly improves outcome of pulmonary vein isolation (PVI) but may cause more complications than the first generation. Currently, no consensus regarding optimal cryoballoon application time exists. The 123-study aimed to assess the minimal cryoballoon application duration necessary to achieve PVI (primary endpoint) and the effect of application duration on prevention of phrenic nerve injury (PNI).
Patients <75 years of age with paroxysmal atrial fibrillation, normal PV anatomy, and left atrial size <40 cc/m² or <50 mm were randomized to two applications of different duration: ""short,"" ""medium,"" or ""long."" A total of 222 patients were enrolled, 74 per group.
Duration per application was 105 (101-108), 164 (160-168), and 224 (219-226) s and isolation was achieved in 79, 89, and 90% (P < 0.001) of the PVs after two applications in groups short, medium, and long, respectively. Only for the left PVs, the success rate of the short group was significantly less compared to the medium- and long-duration groups (P < 0.001). PNI during the procedure occurred in 19 PVs (6.5%) in the medium and in 20 PVs (6.8%) in the long duration groups compared to only five PVs (1.7%) in the short duration group (P < 0.001).
Short cryoballoon ablation application times, less than 2 min, did affect the success for the left PVs but not for the right PVs and resulted in less PNI. A PV tailored approach with shorter application times for the right PVs might be advocated.",,"Duration per application was 105 (101-108), 164 (160-168), and 224 (219-226) s and isolation was achieved in 79, 89, and 90% (P < 0.001) of the PVs after two applications in groups short, medium, and long, respectively. Only for the left PVs, the success rate of the short group was significantly less compared to the medium- and long-duration groups (P < 0.001). PNI during the procedure occurred in 19 PVs (6.5%) in the medium and in 20 PVs (6.8%) in the long duration groups compared to only five PVs (1.7%) in the short duration group (P < 0.001)."
[27769282],27769282,Comparing the effectiveness of the BPMAP (Blood Pressure Management Application) and usual care in self-management of primary hypertension and adherence to treatment in patients aged 30-60 years: study protocol for a randomized controlled trial.,"['Adherence to treatment', 'Hypertension', 'Self-management', 'm-Health']",Trials,"Hypertension is one of the most important and well-known risk factors for cardiovascular diseases. Unfortunately, in spite of effective treatments, adherence to the regular use of drugs and other nondrug treatments, such as lifestyle improvement, is often poor. This study evaluates the effectiveness of an educational, supportive intervention - in the form of a Blood Pressure Management Application (BPMAP) - on self-management in patients with primary hypertension on controlling the determinant factors of hypertension, and on adherence to treatment.
A two-arm, parallel-design randomized controlled clinical trial will be conducted on 30 to 60 year-old patients with primary hypertension who are attending the Tehran Heart Center. One hundred and thirty-two (132) patients will be randomly assigned to the intervention and control (usual method) groups. The most important inclusion criteria are, having primary hypertension and being pharmacologically treated for it, and not having developed the complications of hypertension, such as myocardial infarction, cerebral stroke and cardiac insufficiency. The participants should be able to read Persian and be able to use the application. The most important outcomes of the study include adherence to treatment, weight control, and regular monitoring of blood pressure which are assessed in the primary assessment (baseline data questionnaire) and again at the 8
This application has been programmed to reduce many of the nonadherence factors of hypertension treatment. Therefore, the findings may contribute to a rise in adherence to treatment. If proven to have an appropriate impact, it may be extended for use in the national hypertension control plan.
This study was registered in the Iran Randomized Clinical Trial Center under the number IRCT2015111712211N2 on 1 January 2016.",,
[10429902],10429902,Telemedicine applications in otolaryngology.,[],IEEE engineering in medicine and biology magazine : the quarterly magazine of the Engineering in Medicine & Biology Society,"Under suitable technical and clinical conditions, remote interactive fiber-optic NPL can be used to evaluate a range of commonly occurring pathologies with a high degree of reliability. A clinical protocol appropriate for interactive and store-and-forward fiber-optic NPL was proposed for further evaluation. Additional applications of telemedicine in otolaryngology were outlined, including otoscopy, intra-oral examination, and evaluation of external facial pathology. We envisage tele-otolaryngology taking place in a variety of ways: Interactions between rural-based PCPs and specialists (routine evaluation of hoarseness, dysphagia), using store-and-forward techniques. Consults from emergency medicine physicians at a general service hospital to a specialist (laryngeal trauma, acute peritonsillar abscess, TM perforations) using interactive means. Case discussions between specialist and sub-specialist using a combination of store-and-forward and interactive technologies. Potentially, there are at least three significant benefits from widespread acceptance of telemedicine in the field of otolaryngology, or indeed in any of the medical specialties: Saved lives and reduced medical costs due to early detection of serious pathology (in this case, head and neck cancers). Reduced unnecessary referrals to specialists, and consequent savings to the patient and health-care insurer, accompanied by more efficient usage of specialist time. Enhanced level of medical education and interaction, as the link between the referring and consulting physician is more immediate and direct [27]. For these reasons, combined with the high number of visits at the primary-care level related to issues in otolaryngology-head and neck surgery, tele-otolaryngology is poised to be a leading telemedicine application within the next few years.",,
[32843284],32843284,The Effectiveness of Local Hot and Cold Applications on Peripheral Intravenous Catheterization: A Randomized Controlled Trial.,"['anxiety', 'cold application', 'hot application', 'nursing', 'pain', 'peripheral venous catheter']",Journal of perianesthesia nursing : official journal of the American Society of PeriAnesthesia Nurses,"This study was conducted to examine the effect of local hot and cold applications on pain, anxiety level, insertion time, and vein evaluation before peripheral venous catheter (PVC) insertion.
This randomized controlled trial was conducted with 90 patients who were hospitalized in the cardiology department of a university hospital.
All the data were collected using a patient information form, the Numeric Rating Scale, and Vein Assessment Scale for the assessment of pain and anxiety. Before PVC was inserted, the researcher applied a hot application or a cold application to the catheter insertion site for 1 minute.
Pain level was found to be significantly lower in the hot and cold application groups than the control group, and no difference was determined between the hot and cold application groups. The anxiety levels of the patients were significantly lower in the hot application group than the cold application and control groups (P < .05).
Applying local hot and cold application before inserting the PVC reduced both pain and anxiety levels of the patients. However, hot application increased vein visibility and patient satisfaction and shortened the insertion time, whereas cold application decreased vein visibility, prolonged the insertion time, and decreased patient satisfaction.",,
[31475852],31475852,"A large observational cohort study of rheumatoid arthritis, IORRA: Providing context for today's treatment options.","['Rheumatoid arthritis', 'cohort study', 'real-world evidence']",Modern rheumatology,"Real-world evidence, based on real-world data from routine clinical treatment, is becoming increasingly important for providing high-quality medical care. Large-scale cohort studies can provide useful access to some of this real-world evidence, as shown by the IORRA (Institute of Rheumatology, Rheumatoid Arthritis) cohort in Japan. This large cohort study of patients with rheumatoid arthritis (RA) has been surveying enrolled participants since its inception in 2000. In the last 19 years, it has served as a database for a wide range of research in areas including transitions in medical care at the clinical level, changes in therapeutic drugs, approaches to comorbidities, developments in pharmacoeconomics, and the effects of genomic information on treatment options. This research has resulted in the publication of 133 articles in English to date. IORRA monitors changes in the management of RA, and has quantified over time the daily experience of clinicians who provide routine medical care. Such observational databases, which reflect the reality of daily clinical practice, will become increasingly important and may provide a model for similar research in other disease areas.",,
[26208668],26208668,Relationship Between Prehypertension/Hypertension and Periodontal Disease: A Prospective Cohort Study.,"['blood pressure', 'cohort studies', 'hypertension', 'periodontal disease', 'university students.']",American journal of hypertension,"Most cross-sectional studies have found a significant positive relationship between periodontal disease and prehypertension/hypertension. However, these studies had limitations and there are few prospective cohort studies in young adults. The purpose of this prospective cohort study was to investigate whether periodontal disease was related to prehypertension/hypertension in Japanese university students.
Students (n = 2,588), who underwent health examinations before entering university and before graduation, were included in the analysis. The association between periodontal disease such as the percentage of bleeding on probing (BOP) and community periodontal index (CPI) scores, and change in blood pressure status was determined.
At the reexamination, the numbers of participants with prehypertension (systolic blood pressure 120-139mm Hg or diastolic blood pressure 80-89mm Hg) and hypertension (≥140/90mm Hg) were 882 (34.1%) and 109 (4.2%), respectively. In a logistic regression model, the risk of hypertension was significantly associated with male (odds ratio (OR): 6.31; 95% confidence interval (CI): 2.63-15.13; P < 0.001), no habitual physical activity at baseline (OR: 2.90; 95% CI: 1.56-5.38; P < 0.01) and periodontal disease defined as the presence of both probing pocket depth (PPD) ≥ 4mm and BOP ≥ 30% at baseline (OR: 2.74; 95% CI: 1.19-6.29; P = 0.02) in participants with prehypertension at baseline. On the other hand, the risk of prehypertension was not associated with presence of periodontal disease (OR: 0.93; 95% CI: 0.51-1.70; P = 0.82).
In the short-term prospective cohort study, a significant association between presence of periodontal disease and hypertension was observed in Japanese university students.","In the short-term prospective cohort study, a significant association between presence of periodontal disease and hypertension was observed in Japanese university students.","At the reexamination, the numbers of participants with prehypertension (systolic blood pressure 120-139mm Hg or diastolic blood pressure 80-89mm Hg) and hypertension (≥140/90mm Hg) were 882 (34.1%) and 109 (4.2%), respectively. In a logistic regression model, the risk of hypertension was significantly associated with male (odds ratio (OR): 6.31; 95% confidence interval (CI): 2.63-15.13; P < 0.001), no habitual physical activity at baseline (OR: 2.90; 95% CI: 1.56-5.38; P < 0.01) and periodontal disease defined as the presence of both probing pocket depth (PPD) ≥ 4mm and BOP ≥ 30% at baseline (OR: 2.74; 95% CI: 1.19-6.29; P = 0.02) in participants with prehypertension at baseline. On the other hand, the risk of prehypertension was not associated with presence of periodontal disease (OR: 0.93; 95% CI: 0.51-1.70; P = 0.82)."
