PMID,pubmed_id,title,keywords,journal,abstract,conclusions,results
[19712006],19712006,Case-control studies in pharmacoeconomic research: an overview.,[],PharmacoEconomics,"The case-control approach has been a mainstay of epidemiological studies, particularly those investigating aetiology. Many articles addressing pharmacoeconomic topics have reported studies purported to be of the case-control type. However, on examination, these were actually standard cohort studies that were misnamed because they compared cases of a particular illness to 'controls' without the illness. The actual case-control design involves a series of cases with the outcome of interest. In pharmacoeconomic applications, the outcome of interest would typically be high cost, or hospitalization, or return to full quality of life. The illness does not define cases, but rather is actually the 'exposure'. The 'controls' must be a sample of the study base, not subjects without the illness. In this article, we review the features of a proper case-control study and contrast them with those of the more common cohort study. Confusing the control series of a cohort study with the 'controls' in a case-control study leads to serious problems with understanding the research, its strengths and drawbacks (e.g. confounding concerns), and interpretation of the findings. Although the case-control design has so far been used little to address pharmacoeconomic questions, it can be very efficient in certain situations, particularly when obtaining data on all subjects is burdensome or when conditions provide a ready case series but not the rest of the subjects.",,
[22443481],22443481,Case-control studies of sporadic enteric infections: a review and discussion of studies conducted internationally from 1990 to 2009.,[],Foodborne pathogens and disease,"Epidemiologists have used case-control studies to investigate enteric disease outbreaks for many decades. Increasingly, case-control studies are also used to investigate risk factors for sporadic (not outbreak-associated) disease. While the same basic approach is used, there are important differences between outbreak and sporadic disease settings that need to be considered in the design and implementation of the case-control study for sporadic disease. Through the International Collaboration on Enteric Disease ""Burden of Illness"" Studies (the International Collaboration), we reviewed 79 case-control studies of sporadic enteric infections caused by nine pathogens that were conducted in 22 countries and published from 1990 through to 2009. We highlight important methodological and study design issues (including case definition, control selection, and exposure assessment) and discuss how approaches to the study of sporadic enteric disease have changed over the last 20 years (e.g., making use of more sensitive case definitions, databases of controls, and computer-assisted interviewing). As our understanding of sporadic enteric infections grows, methods and topics for case-control studies are expected to continue to evolve; for example, advances in understanding of the role of immunity can be used to improve control selection, the apparent protective effects of certain foods can be further explored, and case-control studies can be used to provide population-based measures of the burden of disease.",,
[9074849],9074849,Case-control studies and their application to endocrinology.,[],Endocrinology and metabolism clinics of North America,"The steps for undertaking the case-control approach to studying potential causal factors (i.e., host or environmental factors) related to diseases or conditions of interest are outlined, together with warnings of the potential pitfalls and biases to be avoided. Guidelines are provided for appropriate selection of cases and controls and for ascertaining and valid exposure or host information. In addition, the elements needed to determine the sample size needed for a case-control study, the approach to the analysis of case-control data, and criteria for assessing whether associations observed in epidemiologic studies are actually causal also are provided. Finally, the strengths and limitations of the case-control approach, compared with the cohort approach, are described. Published studies are cited to provide endocrinologic examples of the methodologies and issues raised by the case-control study approach.",,
[32178545],32178545,Impact of antimicrobial de-escalation on mortality: a literature review of study methodology and recommendations for observational studies.,"['De-escalation', 'antibiotic stewardship', 'confounding by indication', 'observational studies', 'time-varying confounders']",Expert review of anti-infective therapy,,,
[31980513],31980513,Is austerity responsible for the recent change in mortality trends across high-income nations? A protocol for an observational study.,"['epidemiology', 'international health services', 'public health', 'statistics & research methods']",BMJ open,"Mortality rates in many high-income countries have changed from their long-term trends since around 2011. This paper sets out a protocol for testing the extent to which economic austerity can explain the variance in recent mortality trends across high-income countries.
This is an ecological natural experiment study, which will use regression adjustment to account for differences in exposure, outcomes and confounding. All high-income countries with available data will be included in the sample. The timing of any changes in the trends for four measures of austerity (the Alesina-Ardagna Fiscal Index, real per capita government expenditure, public social spending and the cyclically adjusted primary balance) will be identified and the cumulative difference in exposure to these measures thereafter will be calculated. These will be regressed against the difference in the mean annual change in life expectancy, mortality rates and lifespan variation compared with the previous trends, with an initial lag of 2 years after the identified change point in the exposure measure. The role of underemployment and individual incomes as outcomes in their own right and as mediating any relationship between austerity and mortality will also be considered. Sensitivity analyses varying the lag period to 0 and 5 years, and adjusting for recession, will be undertaken.
All of the data used for this study are publicly available, aggregated datasets with no individuals identifiable. There is, therefore, no requirement for ethical committee approval for the study. The study will be lodged within the National Health Service research governance system. All results of the study will be published following sharing with partner agencies. No new datasets will be created as part of this work for deposition or curation.",,
[30227783],30227783,"Observational Study Design in Veterinary Pathology, Part 2: Methodology.","['epidemiology', 'histologic grading', 'immunohistochemistry', 'method validation', 'observational studies', 'pathology', 'quantitative PCR', 'reproducibility of results', 'research design', 'robustness']",Veterinary pathology,"Observational studies are a basis for much of our knowledge of veterinary pathology, yet considerations for conducting pathology-based observational studies are not readily available. In part 1 of this series, we offered advice on planning and carrying out an observational study. Part 2 of the series focuses on methodology. Our general recommendations are to consider using already-validated methods, published guidelines, data from primary sources, and quantitative analyses. We discuss 3 common methods in pathology research-histopathologic scoring, immunohistochemistry, and polymerase chain reaction-to illustrate principles of method validation. Some aspects of quality control include use of clear objective grading criteria, validation of key reagents, assessing sample quality, determining specificity and sensitivity, use of technical and biologic negative and positive controls, blinding of investigators, approaches to minimizing operator-dependent variation, measuring technical variation, and consistency in analysis of the different study groups. We close by discussing approaches to increasing the rigor of observational studies by corroborating results with complementary methods, using sufficiently large numbers of study subjects, consideration of the data in light of similar published studies, replicating the results in a second study population, and critical analysis of the study findings.",,
[32744037],32744037,Clinical research linking Traditional Chinese Medicine constitution types with diseases: a literature review of 1639 observational studies.,"['Body constitution', 'Clinical study', 'Medicine, Chinese traditional', 'Review']",Journal of traditional Chinese medicine = Chung i tsa chih ying wen pan,"To analyze clinical studies on correlations between Traditional Chinese Medicine (TCM) body constitution types and diseases published in the past 10 years, and to provide an evidence base to support the use of such correlations for health maintenance and disease prevention.
We searched five databases for the period April 2009 to December 2019: China National Knowledge Infrastructure Database, Wanfang Database, China Science and Technology Journal Database, PubMed and Embase. Three types of observational studies on correlation between constitution types and diseases were included: cross-sectional, case-control and cohort studies. Descriptive statistical methods were employed for data analysis.
A total of 1639 clinical studies were identified: 1452 (88.59%) cross-sectional studies, 115 (7.02%) case-control studies and 72 (4.39%) cohort studies covering 30 regions of China and five other countries (Malaysia, South Korea, Singapore, Thailand and France). The collection of studies comprised 19 disease categories and 333 different diseases. The 10 most commonly studied diseases were hypertension, diabetes, stroke, coronary atherosclerotic heart disease (CAHD), sleep disorders, neoplasm of the breast, dysmenorrhea, fatty liver disease, chronic viral hepatitis B and dyslipidemia. We found high distributions for each biased constitution type in different patient populations as follows: Qi-deficiency constitution in stroke, diabetes, chronic obstructive pulmonary disease, acquired immunodeficiency syndrome and hypertension; Yang-deficiency constitution in female infertility, osteoporosis, irritable bowel syndrome, gonarthrosis and dysmenorrhea; Yin-deficiency constitution in hypertension, diabetes, constipation, female climacteric states and osteoporosis; phlegm- dampness constitution in hypertension, stroke, fatty liver disease, diabetes and metabolic syndrome; damp-heat constitution in acne, chronic gastritis, chronic viral hepatitis B, human papillomavirus infection and hyperuricemia; blood-stasis constitution in CAHD, endometriosis and stroke; Qi-stagnation constitution in hyperplasia and neoplasms of the breast, insomnia, depression and thyroid nodules; and inherited-special constitution in asthma and allergic rhinitis.
Eight biased TCM constitutions were closely related to specific diseases, and could be used to guide individualized prevention and treatment. More rigorously designed studies are recommended to further verify the constitution-disease relationship.","Eight biased TCM constitutions were closely related to specific diseases, and could be used to guide individualized prevention and treatment. More rigorously designed studies are recommended to further verify the constitution-disease relationship.","A total of 1639 clinical studies were identified: 1452 (88.59%) cross-sectional studies, 115 (7.02%) case-control studies and 72 (4.39%) cohort studies covering 30 regions of China and five other countries (Malaysia, South Korea, Singapore, Thailand and France). The collection of studies comprised 19 disease categories and 333 different diseases. The 10 most commonly studied diseases were hypertension, diabetes, stroke, coronary atherosclerotic heart disease (CAHD), sleep disorders, neoplasm of the breast, dysmenorrhea, fatty liver disease, chronic viral hepatitis B and dyslipidemia. We found high distributions for each biased constitution type in different patient populations as follows: Qi-deficiency constitution in stroke, diabetes, chronic obstructive pulmonary disease, acquired immunodeficiency syndrome and hypertension; Yang-deficiency constitution in female infertility, osteoporosis, irritable bowel syndrome, gonarthrosis and dysmenorrhea; Yin-deficiency constitution in hypertension, diabetes, constipation, female climacteric states and osteoporosis; phlegm- dampness constitution in hypertension, stroke, fatty liver disease, diabetes and metabolic syndrome; damp-heat constitution in acne, chronic gastritis, chronic viral hepatitis B, human papillomavirus infection and hyperuricemia; blood-stasis constitution in CAHD, endometriosis and stroke; Qi-stagnation constitution in hyperplasia and neoplasms of the breast, insomnia, depression and thyroid nodules; and inherited-special constitution in asthma and allergic rhinitis."
[30071806],30071806,"Observational Study Design in Veterinary Pathology, Part 1: Study Design.","['bias', 'case control', 'cohort', 'descriptive studies', 'epidemiology', 'hypothesis', 'laboratory medicine', 'observational studies', 'pathology', 'reproducibility of results', 'research design', 'study design']",Veterinary pathology,"Observational studies are the basis for much of our knowledge of veterinary pathology and are highly relevant to the daily practice of pathology. However, recommendations for conducting pathology-based observational studies are not readily available. In part 1 of this series, we offer advice on planning and conducting an observational study with examples from the veterinary pathology literature. Investigators should recognize the importance of creativity, insight, and innovation in devising studies that solve problems and fill important gaps in knowledge. Studies should focus on specific and testable hypotheses, questions, or objectives. The methodology is developed to support these goals. We consider the merits and limitations of different types of analytic and descriptive studies, as well as of prospective vs retrospective enrollment. Investigators should define clear inclusion and exclusion criteria and select adequate numbers of study subjects, including careful selection of the most appropriate controls. Studies of causality must consider the temporal relationships between variables and the advantages of measuring incident cases rather than prevalent cases. Investigators must consider unique aspects of studies based on archived laboratory case material and take particular care to consider and mitigate the potential for selection bias and information bias. We close by discussing approaches to adding value and impact to observational studies. Part 2 of the series focuses on methodology and validation of methods.",,
[31596838],31596838,General concepts in biostatistics and clinical epidemiology: Observational studies with cross-sectional and ecological designs.,"[' bias', ' biostatistics', ' cross-sectional studies', ' epidemiology', 'observational study']",Medwave,"Observational studies evaluate variables of interest in a sample or a population, without intervening in them. They can be descriptive if they focus on the description of variables, or analytical when comparison between groups is made to establish associations through statistical inference. Cross-sectional studies and ecologicalalso called correlationalstudies are two observational methodological designs. Cross-sectional studies collect the data of the exposure variable and the outcome at the same time, to describe characteristics of the sample or to study associations. Ecological studies describe and analyze correlations among different variables, and the unit of analysis is aggregated data from multiple individuals. In both types of studies, associations of interest for biomedical research can be established, but no causal relationships should be inferred. This is the second of a methodological series of articles on general concepts in biostatistics and clinical epidemiology developed by the Chair of Scientific Research Methodology at the School of Medicine, University of Valparaíso, Chile. In this review, we address general theoretical concepts about cross-sectional and ecological studies, including applications, measures of association, advantages, disadvantages, and reporting guidelines. Finally, we discuss some concepts about observational designs relevant to undergraduate and graduate students of health sciences.
Los estudios observacionales analizan las variables de interés en la muestra o en la población, sin intervenir en ellas. Pueden ser meramente descriptivos si se focalizan en la descripción de las variables, o analíticos, en el caso de presentar grupos de comparación para establecer asociaciones mediante la inferencia estadística. Los estudios transversales y los estudios ecológicos, también llamados correlacionales, son dos diseños metodológicos observacionales. Los estudios transversales recogen los datos de la variable exposición y desenlace en un mismo momento, para describir sus características y eventualmente estudiar asociaciones. Los estudios ecológicos describen y analizan las correlaciones entre distintas variables, pero su unidad de análisis corresponde a datos agregados de múltiples individuos. En ambos casos no puede inferirse una relación causal, pero sí pueden establecerse asociaciones de gran interés para la investigación biomédica. Esta revisión es la segunda entrega de una serie metodológica sobre conceptos generales en bioestadística y epidemiología clínica desarrollada por la Cátedra de Metodología de la Investigación Científica de la Escuela de Medicina de la Universidad de Valparaíso, Chile. En este artículo se abordan conceptos teóricos generales sobre estudios transversales y estudios ecológicos, considerando sus aplicaciones, medidas de asociación, ventajas, desventajas y reporte. Finalmente, se discuten algunos conceptos de relevancia sobre diseños observacionales para los estudiantes de pre y posgrado de ciencias de la salud.",,
[30878987],30878987,Observational study protocol for evaluating control of hypertension and the effects of social determinants.,"['affordable care act', 'community health centers', 'hypertension', 'medicaid', 'natural experiment']",BMJ open,"Hypertension is a common chronic health condition. Having health insurance reduces hypertension risk; health insurance coverage could improve hypertension screening, treatment and management. The Medicaid eligibility expansion of the Affordable Care Act was ruled not to be required by the US Supreme Court. Subsequently, a 'natural experiment' was produced with some states expanding Medicaid eligibility while others did not. This presents a unique opportunity to learn whether and to what extent Medicaid expansion can affect healthcare access and services for patients at risk for and diagnosed with hypertension, and patients with undiagnosed hypertension. Additionally, social determinants of health (SDH), at both the individual- and community-level, influence diagnosis and care for hypertension and it is important to understand how they interact with health insurance coverage changes.
We will use electronic health record (EHR) data from 
This study uses secondary data analysis and therefore approval for consent to participate was waived. The Institutional Review Board for OHSU approved this study. Approval reference number is: IRB00011858. We plan to disseminate our findings at relevant conferences, meetings and through peer-reviewed journals.
NCT03545763.",,
[31429722],31429722,The endTB observational study protocol: treatment of MDR-TB with bedaquiline or delamanid containing regimens.,"['Bedaquiline', 'Delamanid', 'Efficacy', 'MDR-TB', 'Safety']",BMC infectious diseases,"At a time when programs were struggling to design effective regimens for the treatment of multidrug-resistant tuberculosis (MDR-TB), the marketing authorization of bedaquiline and delamanid was a critical development in the MDR-TB treatment landscape. However, despite their availability for routine programmatic use, the uptake of these drugs has remained slow; concerns included a lack of evidence on safety and efficacy and the need to protect the new drugs from the development of acquired resistance. As part of the endTB Project, we aimed to address these barriers by generating evidence on safety and efficacy of bedaquiline or delamanid based MDR-TB regimens.
This is a protocol for a multi-center prospective cohort study to enroll 2600 patients from April 2015 through September 2018 in 17 countries. The protocol describes inclusion of patients started on treatment with bedaquiline- or delamanid- containing regimens under routine care, who consented to participate in the endTB observational study. Patient follow-up was according to routine monitoring schedules recommended for patients receiving bedaquiline or delamanid as implemented at each endTB site. Therefore, no additional tests were performed as a part of the study. Data were to be collected in a customized, open-source electronic medical record (EMR) system developed as a part of the endTB Project across all 17 countries.
The endTB observational study will generate evidence on safety and efficacy of bedaquiline- and delamanid-containing regimens in a large, extremely heterogeneous group of MDR-TB patients, from 17 epidemiologically diverse countries. The systematic, prospective data collection of repeated effectiveness and safety measures, and analyses performed on these data, will improve the quality of evidence available to inform MDR-TB treatment and policy decisions. Further, the resources available to countries through implementation of the endTB project will have permitted countries to: gain experience with the use of these drugs in MDR-TB regimens, improve local capacity to record and report adverse events (pharmacovigilance), and enhance significantly the body of data available for safety evaluation of these drugs and other novel treatments.
This study was registered on 24 August 2017 at clincaltrials.gov (Registration number: NCT03259269).",,
[33910958],33910958,Efficacy of an implementation package on documentation of central venous catheter insertions: an observational study.,"['critical care', 'healthcare quality improvement', 'patient safety']",BMJ open quality,"Proper documentation of central venous catheter (CVC) insertions in electronic healthcare records is the basis for good follow-up and quality assurance. We have noted serious deficiencies in the documentation of CVC insertions and introduced an implementation package with the purpose of increasing the completeness of this documentation. The aim of the present study was to estimate the effect of the implementation package by assessing the proportion of missing data before and after the introduction of the implementation package.
In this single centre observational study, data from CVC insertion templates in a common electronic health record were extracted and analysed after introducing the implementation package. The package included adoption of new local CVC-directions, a new updated CVC-insertion template in the regional common electronic health record and a review of all CVC-insertion templates with a reminder to the inserting physician to supplement missing data. The proportion of terms with missing data was reviewed and also compared with the proportion of missing data in a study prior to the introduction of the package.
In total, 7126 CVC-insertion templates were included. Of these 5539 (78%) were without missing data for any of the 13 predefined variables. Completed insertion templates for three common terms increased from 38% prior to the introduction of the implementation package to 93%, which represents an absolute reduction for missing data of 55% (95% CI 53% to 56%, p<0.0001).
The implementation package was highly effective in increasing the proportion of fully documented CVC insertions.",The implementation package was highly effective in increasing the proportion of fully documented CVC insertions.,"In total, 7126 CVC-insertion templates were included. Of these 5539 (78%) were without missing data for any of the 13 predefined variables. Completed insertion templates for three common terms increased from 38% prior to the introduction of the implementation package to 93%, which represents an absolute reduction for missing data of 55% (95% CI 53% to 56%, p<0.0001)."
