0,1,2
Simply Piano by JoyTunes,music,"[{'pubmed_id': '32612562\n18270514\n21233387\n17563155\n21517162\n15723890\n9699121\n8916623\n21987072\n22434239\n16325117\n24708352\n3372832\n17516812\n17073523\n9418171\n21984641\n3745650\n26963369\n24068177\n22038472\n19705310\n22582737\n20869282', 'title': 'Music Performance Anxiety: Can Expressive Writing Intervention Help?', 'abstract': ""Performance is an essential part of music education; however, many music professionals and students suffer from music performance anxiety (MPA). The purpose of this study was to investigate whether a 10-min expressive writing intervention (EWI) can effectively reduce performance anxiety and improve overall performance outcomes in college-level piano students. Two groups of music students (16 piano major students and 19 group/secondary piano students) participated in the study. Piano major students performed a solo work from memory, while group/secondary piano students took a sight-reading exam of an eight-measure piano musical selection. All students performed twice, at baseline and post-EWI, with 2 or 3 days between performances. During the EWI phase, students were randomly divided into two groups: an expressive writing group and a control group. Students in the expressive writing group wrote down feelings and thoughts about their upcoming performances, while students in the control group wrote about a topic unrelated to performing. Each student's pulse was recorded immediately before performing, and each performance was videotaped. Three independent judges evaluated the recordings using a modified version of the Observational Scale for Piano Practicing (OSPP) by Gruson (1988). The results revealed that, by simply writing out their thoughts and feelings right before performing, students who had high MPA improved their performance quality significantly and reduced their MPA significantly. Our findings suggest that EWI may be a viable tool to alleviate music performance anxiety."", 'keywords': ['expressive writing intervention', 'music performance anxiety', 'performance quality', 'piano playing', 'self-talk'], 'journal': 'Frontiers in psychology', 'publication_date': datetime.date(2020, 7, 3), 'authors': [{'lastname': 'Tang', 'firstname': 'Yiqing', 'initials': 'Y', 'affiliation': 'Fred Fox School of Music, The University of Arizona, Tucson, AZ, United States.'}, {'lastname': 'Ryan', 'firstname': 'Lee', 'initials': 'L', 'affiliation': 'Department of Psychology, The University of Arizona, Tucson, AZ, United States.'}], 'methods': None, 'conclusions': None, 'results': None, 'copyrights': 'Copyright © 2020 Tang and Ryan.', 'doi': '10.3389/fpsyg.2020.01334', 'xml': <Element 'PubmedArticle' at 0x000002BF3C403E50>}, {'pubmed_id': '31093269\n7666169\n12911767\n9629964\n14642491\n23259944\n19833552\n9822764\n23064109\n11053230\n16930423\n16706859\n18301777\n25309407\n15268927\n12830158\n26351994\n7666197\n17114055\n27684369\n12042882\n10548103\n10511638\n21909322\n19273828\n18328510\n25191246\n17494706\n19741119\n21397699\n16495361\n11306630\n17585307\n15831405\n15062860\n12037204\n17719015\n11388435\n14575529\n25797650\n15165553\n19463837\n19366283\n10220228\n11976767\n16271503\n11849307\n15811240\n8922425\n16099349\n16380270\n12408840\n16870725\n15858053\n26880543\n20688131\n23236203\n8416078\n23472216\n9535135\n26923030\n14534258\n22832238\n8828897\n11564322\n17215391\n22850360\n10080372\n9772253\n19673823', 'title': 'Cross-Modal Audiovisual Modulation of Corticospinal Motor Synergies in Professional Piano Players: A TMS Study during Motor Imagery.', 'abstract': 'Transcranial magnetic stimulation was used to investigate corticospinal output changes in 10 professional piano players during motor imagery of triad chords in C major to be ""mentally"" performed with three fingers of the right hand (thumb, index, and little finger). Five triads were employed in the task; each composed by a stable 3rd interval (C4-E4) and a varying third note that could generate a 5th (G4), a 6th (A4), a 7th (B4), a 9th (D5), or a 10th (E5) interval. The 10th interval chord was thought to be impossible in actual execution for biomechanical reasons, as long as the thumb and the index finger remained fixed on the 3rd interval. Chords could be listened from loudspeakers, read on a staff, or listened and read at the same time while performing the imagery task. The corticospinal output progressively increased along with task demands in terms of mental representation of hand extension. The effects of audio, visual, or audiovisual musical stimuli were generally similar, unless motor imagery of kinetically impossible triads was required. A specific three-effector motor synergy was detected, governing the representation of the progressive mental extension of the hand. Results demonstrate that corticospinal facilitation in professional piano players can be modulated according to the motor plan, even if simply ""dispatched"" without actual execution. Moreover, specific muscle synergies, usually encoded in the motor cortex, emerge along the cross-modal elaboration of musical stimuli and in motor imagery of musical performances.', 'keywords': [], 'journal': 'Neural plasticity', 'publication_date': datetime.date(2019, 5, 17), 'authors': [{'lastname': 'Rossi', 'firstname': 'Simone', 'initials': 'S', 'affiliation': 'Department of Medicine, Surgery and Neuroscience, Unit of Neurology and Clinical Neurophysiology, Siena Brain Investigation and Neuromodulation Lab (Si-BIN Lab), University of Siena, Italy.'}, {'lastname': 'Spada', 'firstname': 'Danilo', 'initials': 'D', 'affiliation': 'Department of Brain and Behavioral Sciences, University of Pavia, Italy.'}, {'lastname': 'Emanuele', 'firstname': 'Marco', 'initials': 'M', 'affiliation': 'Section of Human Physiology, University of Ferrara, Italy.'}, {'lastname': 'Ulivelli', 'firstname': 'Monica', 'initials': 'M', 'affiliation': 'Department of Medicine, Surgery and Neuroscience, Unit of Neurology and Clinical Neurophysiology, Siena Brain Investigation and Neuromodulation Lab (Si-BIN Lab), University of Siena, Italy.'}, {'lastname': 'Santarnecchi', 'firstname': 'Emiliano', 'initials': 'E', 'affiliation': 'Department of Medicine, Surgery and Neuroscience, Unit of Neurology and Clinical Neurophysiology, Siena Brain Investigation and Neuromodulation Lab (Si-BIN Lab), University of Siena, Italy.\nBerenson-Allen Center for Noninvasive Brain Stimulation, Department of Neurology, Division of Cognitive Neurology, Beth Israel Deaconess Medical Center, Harvard Medical School, Boston, MA, USA.'}, {'lastname': 'Fadiga', 'firstname': 'Luciano', 'initials': 'L', 'affiliation': 'Section of Human Physiology, University of Ferrara, Italy.\nCenter for Translational Neurophysiology, Istituto Italiano di Tecnologia, Italy.'}, {'lastname': 'Prattichizzo', 'firstname': 'Domenico', 'initials': 'D', 'affiliation': 'Human Centered Robotics Group, SIRSLab, Department of Information Engineering and Mathematics, University of Siena, Italy.'}, {'lastname': 'Rossi', 'firstname': 'Alessandro', 'initials': 'A', 'affiliation': 'Department of Medicine, Surgery and Neuroscience, Unit of Neurology and Clinical Neurophysiology, Siena Brain Investigation and Neuromodulation Lab (Si-BIN Lab), University of Siena, Italy.'}, {'lastname': 'Perani', 'firstname': 'Daniela', 'initials': 'D', 'affiliation': 'Vita Salute San Raffaele University, Division of Neuroscience, Scientific Institute San Raffaele, Milan, Italy.'}], 'methods': None, 'conclusions': None, 'results': None, 'copyrights': None, 'doi': '10.1155/2019/1328453', 'xml': <Element 'PubmedArticle' at 0x000002BF3C40F310>}]"
Learn English - Language & Grammar,language,"[{'pubmed_id': '34860559', 'title': 'Artificial Grammar Learning in Children With Developmental Language Disorder.', 'abstract': 'The purpose of the study was to evaluate implicit learning in children with developmental language disorder (DLD) by employing a visual artificial grammar learning task.\nThirteen children with DLD and 24 children with typical language development between the ages of 8 and 12 years completed a visual artificial grammar learning task. During the training phase of the task, participants were presented with strings of shapes that followed the underlying structure of a finite grammar. During the testing phase, participants were asked to judge whether new strings were grammatical or nongrammatical. Grammatical judgment of new strings served to measure generalization of the underlying grammatical structure. Endorsement based on chunk strength, or similarity to training exemplars, served to evaluate the extent to which children relied on surface features to guide their task performance.\nAs a group, children with typical development performed better on the artificial grammar learning task, compared with children with DLD, and accepted more grammatical strings regardless of their similarity to training exemplars. Task performance in both groups was not affected by surface features. Performance of children with DLD whose test accuracy exceeded the learning threshold of 0.5 was consistent with a generalization of the underlying grammatical structure that was unaffected by surface features.\nThe study found group differences in learning outcomes between children with and without DLD. Consistent with previous reports, children with typical development correctly endorsed more grammatical strings than children with DLD, suggesting a better acquisition of the grammatical structure. However, there was no evidence to suggest that children in the DLD group (learners and nonlearners) relied on surface features (i.e., familiarity to training exemplars) in their grammatical judgment. These results refute our hypothesis that children in the DLD group would show judgment based on familiarity.', 'keywords': [], 'journal': 'Journal of speech, language, and hearing research : JSLHR', 'publication_date': datetime.date(2021, 12, 4), 'authors': [{'lastname': 'Gillis', 'firstname': 'Jasmine Urquhart', 'initials': 'JU', 'affiliation': 'Department of Communication Sciences and Disorders, MGH Institute of Health Professions, Boston, MA.'}, {'lastname': 'Gul', 'firstname': 'Asiya', 'initials': 'A', 'affiliation': 'Department of Communication Sciences and Disorders, MGH Institute of Health Professions, Boston, MA.'}, {'lastname': 'Fox', 'firstname': 'Annie', 'initials': 'A', 'affiliation': 'Department of Communication Sciences and Disorders, MGH Institute of Health Professions, Boston, MA.'}, {'lastname': 'Parikh', 'firstname': 'Aditi', 'initials': 'A', 'affiliation': 'Department of Communication Sciences and Disorders, MGH Institute of Health Professions, Boston, MA.'}, {'lastname': 'Arbel', 'firstname': 'Yael', 'initials': 'Y', 'affiliation': 'Department of Communication Sciences and Disorders, MGH Institute of Health Professions, Boston, MA.'}], 'methods': 'Thirteen children with DLD and 24 children with typical language development between the ages of 8 and 12 years completed a visual artificial grammar learning task. During the training phase of the task, participants were presented with strings of shapes that followed the underlying structure of a finite grammar. During the testing phase, participants were asked to judge whether new strings were grammatical or nongrammatical. Grammatical judgment of new strings served to measure generalization of the underlying grammatical structure. Endorsement based on chunk strength, or similarity to training exemplars, served to evaluate the extent to which children relied on surface features to guide their task performance.', 'conclusions': None, 'results': 'As a group, children with typical development performed better on the artificial grammar learning task, compared with children with DLD, and accepted more grammatical strings regardless of their similarity to training exemplars. Task performance in both groups was not affected by surface features. Performance of children with DLD whose test accuracy exceeded the learning threshold of 0.5 was consistent with a generalization of the underlying grammatical structure that was unaffected by surface features.', 'copyrights': None, 'doi': '10.1044/2021_JSLHR-21-00050', 'xml': <Element 'PubmedArticle' at 0x000002BF3C427F90>}, {'pubmed_id': '34858245\n15667929\n11740500\n10195106\n23768770\n32952462\n27013677\n21417512\n23089290\n26855443\n10782103\n14741005\n28680505\n29106269\n1604866\n14643371\n26151465\n15992791\n28340356\n24711798\n20434141\n24298143\n13310704\n16860742\n23055160\n2381998\n21347988\n20615499\n26638049\n31012079\n19379051\n21607804\n26861215\n30572180\n28641107\n24000273\n17083927\n8943209\n9872745\n28481118\n19324332\n27659950\n19851941\n12219809\n19968438\n31212192', 'title': 'Fast but Not Furious. When Sped Up Bit Rate of Information Drives Rule Induction.', 'abstract': 'The language abilities of young and adult learners range from memorizing specific items to finding statistical regularities between them (', 'keywords': ['bit rate', 'category formation', 'channel capacity (information rate)', 'entropy', 'generalization (psychology)', 'rule induction'], 'journal': 'Frontiers in psychology', 'publication_date': datetime.date(2021, 12, 4), 'authors': [{'lastname': 'Radulescu', 'firstname': 'Silvia', 'initials': 'S', 'affiliation': 'Utrecht Institute of Linguistics-OTS, Utrecht University, Utrecht, Netherlands.'}, {'lastname': 'Kotsolakou', 'firstname': 'Areti', 'initials': 'A', 'affiliation': 'Utrecht Institute of Linguistics-OTS, Utrecht University, Utrecht, Netherlands.'}, {'lastname': 'Wijnen', 'firstname': 'Frank', 'initials': 'F', 'affiliation': 'Utrecht Institute of Linguistics-OTS, Utrecht University, Utrecht, Netherlands.'}, {'lastname': 'Avrutin', 'firstname': 'Sergey', 'initials': 'S', 'affiliation': 'Utrecht Institute of Linguistics-OTS, Utrecht University, Utrecht, Netherlands.'}, {'lastname': 'Grama', 'firstname': 'Ileana', 'initials': 'I', 'affiliation': 'Amsterdam Centre for Language and Communication, Faculty of Humanities, University of Amsterdam, Amsterdam, Netherlands.'}], 'methods': None, 'conclusions': None, 'results': None, 'copyrights': 'Copyright © 2021 Radulescu, Kotsolakou, Wijnen, Avrutin and Grama.', 'doi': '10.3389/fpsyg.2021.661785', 'xml': <Element 'PubmedArticle' at 0x000002BF3C432C20>}]"
Little Panda's Farm Story,counting,[]
Pinkfong Baby Shark,creativity,"[{'pubmed_id': '33853007', 'title': 'Investigating links between thermal tolerance and oxygen supply capacity in shark neonates from a hyperoxic tropical environment.', 'abstract': 'Temperature and oxygen limit the distribution of marine ectotherms. Haematological traits underlying blood-oxygen carrying capacity are thought to be correlated with thermal tolerance in certain fishes, and this relationship is hypothesised to be explained by oxygen supply capacity. We tested this hypothesis using reef shark neonates as experimental models because they live near their upper thermal limits and are physiologically sensitive to low oxygen conditions. We first described in situ associations between temperature and oxygen at the study site (Moorea, French Polynesia) and found that the habitats for reef shark neonates (Carcharhinus melanopterus and Negaprion acutidens) were hyperoxic at the maximum recorded temperatures. Next, we tested for in situ associations between thermal habitat characteristics and haematological traits of neonates. Contrary to predictions, we only demonstrated a negative association between haemoglobin concentration and maximum habitat temperatures in C. melanopterus. Next, we tested for ex situ associations between critical thermal maximum (CT', 'keywords': ['Critical thermal maximum', 'Haematocrit', 'Haemoglobin', 'Oxygen supply capacity', 'Reef sharks', 'p(crit)'], 'journal': 'The Science of the total environment', 'publication_date': datetime.date(2021, 4, 15), 'authors': [{'lastname': 'Bouyoucos', 'firstname': 'Ian A', 'initials': 'IA', 'affiliation': 'Australian Research Council Centre of Excellence for Coral Reef Studies, James Cook University, Townsville, Queensland 4811, Australia; PSL Research University, EPHE-UPVD-CNRS, USR 3278 CRIOBE, Université de Perpignan, 58 Avenue Paul Alduy, 66860 Perpignan Cedex, France. Electronic address: ian.bouyoucos@my.jcu.edu.au.'}, {'lastname': 'Trujillo', 'firstname': 'José E', 'initials': 'JE', 'affiliation': 'Department of Marine Science, University of Otago, Dunedin 9016, New Zealand.'}, {'lastname': 'Weideli', 'firstname': 'Ornella C', 'initials': 'OC', 'affiliation': 'PSL Research University, EPHE-UPVD-CNRS, USR 3278 CRIOBE, Université de Perpignan, 58 Avenue Paul Alduy, 66860 Perpignan Cedex, France.'}, {'lastname': 'Nakamura', 'firstname': 'Nao', 'initials': 'N', 'affiliation': 'PSL Research University, EPHE-UPVD-CNRS, USR 3278 CRIOBE, Université de Perpignan, 58 Avenue Paul Alduy, 66860 Perpignan Cedex, France.'}, {'lastname': 'Mourier', 'firstname': 'Johann', 'initials': 'J', 'affiliation': 'PSL Research University, EPHE-UPVD-CNRS, USR 3278 CRIOBE, Université de Perpignan, 58 Avenue Paul Alduy, 66860 Perpignan Cedex, France; Laboratoire d\'Excellence ""CORAIL"", EPHE, PSL Research University, UPVD, CNRS, USR 3278 CRIOBE, Papetoai, Moorea, French Polynesia; Université de Corse Pasquale Paoli, UMS 3514 Plateforme Marine Stella Mare, 20620 Biguglia, France.'}, {'lastname': 'Planes', 'firstname': 'Serge', 'initials': 'S', 'affiliation': 'PSL Research University, EPHE-UPVD-CNRS, USR 3278 CRIOBE, Université de Perpignan, 58 Avenue Paul Alduy, 66860 Perpignan Cedex, France; Laboratoire d\'Excellence ""CORAIL"", EPHE, PSL Research University, UPVD, CNRS, USR 3278 CRIOBE, Papetoai, Moorea, French Polynesia.'}, {'lastname': 'Simpfendorfer', 'firstname': 'Colin A', 'initials': 'CA', 'affiliation': 'Centre for Sustainable Tropical Fisheries and Aquaculture & College of Science and Engineering, James Cook University, Townsville, Queensland 4811, Australia.'}, {'lastname': 'Rummer', 'firstname': 'Jodie L', 'initials': 'JL', 'affiliation': 'Australian Research Council Centre of Excellence for Coral Reef Studies, James Cook University, Townsville, Queensland 4811, Australia.'}], 'methods': None, 'conclusions': None, 'results': None, 'copyrights': 'Copyright © 2021 Elsevier B.V. All rights reserved.', 'doi': '10.1016/j.scitotenv.2021.146854', 'xml': <Element 'PubmedArticle' at 0x000002BF3C445E50>}, {'pubmed_id': '33447940', 'title': 'Mercury in neonatal and juvenile blacktip sharks (Carcharhinus limbatus). Part II: Effects assessment.', 'abstract': 'As apex predators, blacktip sharks (Carcharhinus limbatus) are highly susceptible to biomagnified mercury (Hg) particularly in the Gulf of Mexico (GOM), which is known to contain fishes and invertebrates with elevated Hg levels. Blacktip sharks occur in the GOM year-round and are heavily fished both commercially and recreationally, but little is known about how Hg affects the species. In this study, blood, muscle, liver, and kidney samples were collected from neonatal (n\u2009=\u200957) and juvenile (n\u2009=\u200913) blacktip sharks in Charlotte Harbor, Florida. Hg concentrations in neonates and juveniles were found to be elevated in muscle (mean\u2009±\u2009SE\u2009=\u20090.59\u2009±\u20090.23\u2009mg\u2009kg', 'keywords': ['Elasmobranch', 'Hematology', 'Histology', 'Juvenile', 'Mercury', 'Neonate'], 'journal': 'Ecotoxicology (London, England)', 'publication_date': datetime.date(2021, 1, 16), 'authors': [{'lastname': 'Norris', 'firstname': 'Sarah B', 'initials': 'SB', 'affiliation': 'Florida Gulf Coast University, 10501 FGCU Blvd South, Fort Myers, FL, 33965, USA. sarahnbnorris@gmail.com.'}, {'lastname': 'Reistad', 'firstname': 'Nicole A', 'initials': 'NA', 'affiliation': 'Florida Gulf Coast University, 10501 FGCU Blvd South, Fort Myers, FL, 33965, USA.'}, {'lastname': 'Rumbold', 'firstname': 'Darren G', 'initials': 'DG', 'affiliation': 'Florida Gulf Coast University, 10501 FGCU Blvd South, Fort Myers, FL, 33965, USA.'}], 'methods': None, 'conclusions': None, 'results': None, 'copyrights': None, 'doi': '10.1007/s10646-020-02325-x\n10.1016/j.envres.2013.05.010\n10.1016/j.scitotenv.2010.08.019\n10.1638/2009-0023.1\n10.1080/03601239009372677\n10.1016/j.cbpa.2013.01.024\n10.1016/j.envpol.2016.03.003\n10.1515/REVEH.2005.20.1.39\n10.1016/j.cbpa.2011.04.012\n10.1525/california/9780520271630.003.0009\n10.1080/10408440600845619\n10.1006/jmsc.1999.0489\n10.1007/s10661-011-2304-3\n10.1289/ehp.9918\n10.3354/ab00252\n10.1021/es305071v\n10.1007/s00244-019-00691-0\n10.7289/V50Z717Z\n10.3354/meps10490\n10.1177/0300985813482147\n10.1007/BF00285441\n10.1016/0013-9351(85)90028-3\n10.1007/s00244-016-0268-6\n10.1016/j.ecoenv.2007.08.016\n10.1111/j.1939-165X.2002.tb00289.x\n10.1016/j.envres.2012.08.013\n10.1016/j.envres.2012.08.001\n10.1111/j.0022-1112.2006.00942.x\n10.3354/meps07918\n10.3390/ijms161226183\n10.1016/j.cbpc.2007.09.002\n10.1016/j.mrgentox.2008.09.015\n10.1289/ehp.1002609\n10.1016/j.ecoenv.2018.01.057\n10.1016/j.marenvres.2013.05.009\n10.1139/cjfas-2013-0222\n10.1016/j.scitotenv.2015.02.004\n10.1577/1548-8659(2001)1302.0.CO;2\n10.1016/j.ecoenv.2006.11.013\n10.1016/j.marpolbul.2019.03.018\n10.1371/journal.pone.0062886\n10.1007/s10695-015-0150-x\n10.1111/vcp.12254\n10.1016/j.chemosphere.2006.07.053\n10.3961/jpmph.2014.47.2.74\n10.1007/s00244-014-0050-6\n10.1016/j.ecss.2017.10.018\n10.1007/s41742-017-0023-5\n10.1007/s00244-011-9651-5\n10.5897/JTEHS12.028\n10.1007/s00128-004-0513-y\n10.1186/1471-2164-11-212\n10.1016/j.envint.2006.10.007\n10.1016/j.scitotenv.2017.02.191\n10.1016/j.cbpa.2013.03.006\n10.1016/j.chemosphere.2009.06.005\n10.1897/1551-5028(2003)222.0.co;2\n10.1016/j.marpolbul.2014.12.056\n10.2741/2141\n10.1016/j.chemosphere.2009.10.022\n10.1006/jmsc.1999.0493', 'xml': <Element 'PubmedArticle' at 0x000002BF3C4564F0>}]"
My Town: After School Neighborhood Street,science,[]
Ice Queen's Beauty SPA Salon,sport,[]
ABCmouse.com,language,[]
"Colors for Kids, Toddlers, Babies - Learning Game",creativity,[]
Crayon Shinchan Operation Little Helper,counting,[]
Logic Puzzle & Memory Games for Brain Training,sport,[]
Cars,creativity,[]
