0,1,2
Lingokids - A fun learning adventure,music,"[{'pubmed_id': '34564558\n32019104\n17133134\n16204405\n29465450\n29180148\n26089556\n24249858\n11837376\n12742794\n16046764\n27402978\n16594366\n26089568', 'title': 'Reimagining Pharmacy Education through the Lens of a Choose Your Own Adventure Activity-A Qualitative Evaluation.', 'abstract': ""Successful pharmacy curricula expose students to a variety of teaching and assessment methods to prepare students for clinical practice. However, development of clinical decision-making skills is often challenging for learners. To meet this need, the Choose Your Own Adventure (CYOA) Patient Case Format was developed to enhance traditional paper patient cases by integrating problem-based and case-based learning to improve pharmacy student learning. The objectives of this evaluation were to qualitatively evaluate the CYOA case format. The qualitative assessment of the student pharmacist's learning experience utilizing this novel patient case format was used to formulate a template for extrapolation to other disease states.\nFocus groups were conducted with second year Pharm.D. students enrolled at the University of Tennessee Health Science Center (UTHSC) College of Pharmacy. The focus groups were conducted in Fall 2020, beginning the week after they were exposed to the CYOA case format. The corpus of data was analyzed thematically to identify themes using inductive coding. To establish the validity of this evaluation, the team met to assess the consistency of the data reduction methods and guard against methodological issues that could influence and affect coding decisions.\nParticipants were recruited until thematic saturation was achieved. Out of 25 participants, 23 participants provided demographic information, with 74% identifying as female. Thematic analysis identified three themes: (1) "", 'keywords': ['Choose Your Own Adventure (CYOA)', 'pharmacy curriculum', 'realistic scenarios', 'student pharmacist'], 'journal': 'Pharmacy (Basel, Switzerland)', 'publication_date': datetime.date(2021, 9, 27), 'authors': [{'lastname': 'Scott', 'firstname': 'Devin', 'initials': 'D', 'affiliation': 'Teaching and Learning Center, College of Pharmacy, The University of Tennessee Health Science Center, Memphis, TN 38163, USA.'}, {'lastname': 'Cernasev', 'firstname': 'Alina', 'initials': 'A', 'affiliation': 'Department of Clinical Pharmacy and Translational Science, College of Pharmacy, The University of Tennessee Health Science Center, 301 S Perimeter Park Dr., Suite 220, Nashville, TN 37211, USA.'}, {'lastname': 'Kiles', 'firstname': 'Tyler Marie', 'initials': 'TM', 'affiliation': 'Department of Clinical Pharmacy and Translational Science, College of Pharmacy, The University of Tennessee Health Science Center, Memphis, TN 38163, USA.'}], 'methods': None, 'conclusions': None, 'results': 'Participants were recruited until thematic saturation was achieved. Out of 25 participants, 23 participants provided demographic information, with 74% identifying as female. Thematic analysis identified three themes: (1) ', 'copyrights': None, 'doi': '10.3390/pharmacy9030151', 'xml': <Element 'PubmedArticle' at 0x000002BF3C5AADB0>}, {'pubmed_id': '32431315\n27099335\n30446291\n19657503\n21436899\n27402634\n29955539\n30323394\n28289294\n28289312\n29109566', 'title': 'An Artistic Active-Learning Approach to Teaching a Substance Use Disorder Elective Course.', 'abstract': '', 'keywords': ['active learning', 'addiction', 'arts and health', 'pharmacy law', 'substance use disorder'], 'journal': 'American journal of pharmaceutical education', 'publication_date': datetime.date(2020, 5, 21), 'authors': [{'lastname': 'Steinhardt', 'firstname': 'Sarah J', 'initials': 'SJ', 'affiliation': 'University of South Florida College of Pharmacy, Tampa, Florida.'}, {'lastname': 'Kelly', 'firstname': 'William N', 'initials': 'WN', 'affiliation': 'University of South Florida College of Pharmacy, Tampa, Florida.'}, {'lastname': 'Clark', 'firstname': 'John E', 'initials': 'JE', 'affiliation': 'University of South Florida College of Pharmacy, Tampa, Florida.'}, {'lastname': 'Hill', 'firstname': 'Angela M', 'initials': 'AM', 'affiliation': 'University of South Florida College of Pharmacy, Tampa, Florida.'}], 'methods': None, 'conclusions': None, 'results': None, 'copyrights': '© 2020 American Association of Colleges of Pharmacy.', 'doi': '10.5688/ajpe7634', 'xml': <Element 'PubmedArticle' at 0x000002BF3C5B9540>}]"
Sweet Baby Girl Cleanup 5 - Messy House Makeover,shape,[]
My Little Princess Castle - Playhouse & Girls Game,creativity,[]
Kid-E-Cats. Educational Games,creativity,"[{'pubmed_id': '34878067', 'title': 'SCREENER, an educational game for teaching the Drug Discovery and Development process.', 'abstract': 'Although the use of games as an educational strategy is an important current trend, there is practically no option available for training people on the Drug Discovery and Development (DDD) process. To fill this gap, we designed ""SCREENER"", a science game that is intended to be educational, but also challenging and interesting enough to ensure player engagement. Our main target audience is students of postgraduate programs in pharmacology, medicinal chemistry, pharmacy, and medicine. This game could also be of interest to the pharmaceutical industry and regulatory and patent agencies for training new employees. We discuss the creation of SCREENER, a hybrid of board and card games, and present its components with some examples of cards and resources, as well as the dynamics of the game. SCREENER mimics the process of drug discovery and development from validating a target to registering the new drug with the regulatory agency, and can be played individually (self-learning) or with the help of a monitor who assists up to six players/teams. Briefly, 29 task cards categorized in four major areas (efficacy, safety, pharmacokinetics, and pharmaceutical development) must be purchased sequentially. Classic characteristics of games such as decision making and challenge have been incorporated. More in-depth information on the tasks and technical terms is available through QR codes. The vagaries of the DDD process are mimicked by the bonus/setback cards. The evaluation of our first test with students is presented and supports the usefulness of this new tool.', 'keywords': [], 'journal': 'Brazilian journal of medical and biological research = Revista brasileira de pesquisas medicas e biologicas', 'publication_date': datetime.date(2021, 12, 9), 'authors': [{'lastname': 'Noël', 'firstname': 'F', 'initials': 'F', 'affiliation': 'Laboratório de Farmacologia Bioquímica e Molecular, Instituto de Ciências Biomédicas, Universidade Federal do Rio de Janeiro, Rio de Janeiro, RJ, Brasil.\nPrograma de Pós-Graduação em Farmacologia e Química Medicinal, Universidade Federal do Rio de Janeiro, Rio de Janeiro, RJ, Brasil.\nInstituto Nacional de Ciência e Tecnologia em Fármacos e Medicamentos, Rio de Janeiro, RJ, Brasil.'}, {'lastname': 'Xexéo', 'firstname': 'G', 'initials': 'G', 'affiliation': 'Laboratório de Ludologia, Engenharia e Simulação, Programa de Engenharia de Sistemas e Computação, COPPE, Universidade Federal do Rio de Janeiro, Rio de Janeiro, RJ, Brasil.\nDepartamento de Ciência da Computação, Instituto de Matemática, Universidade Federal do Rio de Janeiro, Rio de Janeiro, RJ, Brasil.'}, {'lastname': 'Mangeli', 'firstname': 'E', 'initials': 'E', 'affiliation': 'Laboratório de Ludologia, Engenharia e Simulação, Programa de Engenharia de Sistemas e Computação, COPPE, Universidade Federal do Rio de Janeiro, Rio de Janeiro, RJ, Brasil.\nInstituto de Computação, Universidade Federal do Rio de Janeiro, Rio de Janeiro, RJ, Brasil.'}, {'lastname': 'Mothé', 'firstname': 'A', 'initials': 'A', 'affiliation': 'Laboratório de Farmacologia Bioquímica e Molecular, Instituto de Ciências Biomédicas, Universidade Federal do Rio de Janeiro, Rio de Janeiro, RJ, Brasil.\nLaboratório de Ludologia, Engenharia e Simulação, Programa de Engenharia de Sistemas e Computação, COPPE, Universidade Federal do Rio de Janeiro, Rio de Janeiro, RJ, Brasil.\nEscola de Belas Artes, Universidade Federal do Rio de Janeiro, Rio de Janeiro, RJ, Brasil.'}, {'lastname': 'Marques', 'firstname': 'P', 'initials': 'P', 'affiliation': 'Laboratório de Ludologia, Engenharia e Simulação, Programa de Engenharia de Sistemas e Computação, COPPE, Universidade Federal do Rio de Janeiro, Rio de Janeiro, RJ, Brasil.\nInstituto de Computação, Universidade Federal do Rio de Janeiro, Rio de Janeiro, RJ, Brasil.'}, {'lastname': 'Kritz', 'firstname': 'J', 'initials': 'J', 'affiliation': 'Laboratório de Ludologia, Engenharia e Simulação, Programa de Engenharia de Sistemas e Computação, COPPE, Universidade Federal do Rio de Janeiro, Rio de Janeiro, RJ, Brasil.'}, {'lastname': 'Blanchard', 'firstname': 'F', 'initials': 'F', 'affiliation': 'Laboratório de Farmacologia Bioquímica e Molecular, Instituto de Ciências Biomédicas, Universidade Federal do Rio de Janeiro, Rio de Janeiro, RJ, Brasil.\nLaboratório de Ludologia, Engenharia e Simulação, Programa de Engenharia de Sistemas e Computação, COPPE, Universidade Federal do Rio de Janeiro, Rio de Janeiro, RJ, Brasil.\nEscola Politécnica, Universidade Federal do Rio de Janeiro, Rio de Janeiro, RJ, Brasil.'}, {'lastname': 'Vermelho', 'firstname': 'H', 'initials': 'H', 'affiliation': 'Laboratório de Ludologia, Engenharia e Simulação, Programa de Engenharia de Sistemas e Computação, COPPE, Universidade Federal do Rio de Janeiro, Rio de Janeiro, RJ, Brasil.\nInstituto de Computação, Universidade Federal do Rio de Janeiro, Rio de Janeiro, RJ, Brasil.'}, {'lastname': 'Paiva', 'firstname': 'B de', 'initials': 'B', 'affiliation': 'Laboratório de Farmacologia Bioquímica e Molecular, Instituto de Ciências Biomédicas, Universidade Federal do Rio de Janeiro, Rio de Janeiro, RJ, Brasil.\nLaboratório de Ludologia, Engenharia e Simulação, Programa de Engenharia de Sistemas e Computação, COPPE, Universidade Federal do Rio de Janeiro, Rio de Janeiro, RJ, Brasil.\nEscola Politécnica, Universidade Federal do Rio de Janeiro, Rio de Janeiro, RJ, Brasil.'}], 'methods': None, 'conclusions': None, 'results': None, 'copyrights': None, 'doi': '10.1590/1414-431X2021e11786', 'xml': <Element 'PubmedArticle' at 0x000002BF3C5C34A0>}]"
Learn to Read with Tommy Turtle,music,[]
Baby Panda's Fire Safety,science,[]
Baby Panda’s Color Mixing Studio,creativity,[]
"Babyphone - baby music games with Animals, Numbers",counting,[]
Multiplication table. Learn and Play!,counting,"[{'pubmed_id': '14565025', 'title': '[Study on the function localization during different brain calculation tasks].', 'abstract': 'The aim of this study is to define the anatomical localization of corresponding brain function area during calculating. The activating modes in brain during continuous silent calculating subtraction and repeated silent reading multiplication table were compared and investigated. Fourteen volunteers of right-handedness were enrolled in this experiment. The quite different reaction models in brain area during the two models of calculation revealed that there are different processing pathways in brain during these two operating tasks. During continuous silent calculating, the function areas were found localized on the posterior portion of superior and middle gyrus of frontal lobe and the lobule of posterior parietal lobe (P < 0.01, T = 5.41), demonstrating that these function areas play an important role in the performance of calculation and working memory. During repeated silent reading multiplication table, the activating cluster was found only located in in the gyri occipital lateral(P < 0.01, T = 4.77).', 'keywords': [], 'journal': 'Sheng wu yi xue gong cheng xue za zhi = Journal of biomedical engineering = Shengwu yixue gongchengxue zazhi', 'publication_date': datetime.date(2003, 10, 21), 'authors': [{'lastname': 'Wang', 'firstname': 'Mingshi', 'initials': 'M', 'affiliation': 'College of Precision Instrument and Opto-electronics Engineering, Tianjin University, Tianjin 300072.'}, {'lastname': 'Wang', 'firstname': 'Liqun', 'initials': 'L', 'affiliation': None}, {'lastname': 'Li', 'firstname': 'Yuezhi', 'initials': 'Y', 'affiliation': None}, {'lastname': 'Wang', 'firstname': 'Xuemin', 'initials': 'X', 'affiliation': None}], 'methods': None, 'conclusions': None, 'results': None, 'copyrights': None, 'doi': None, 'xml': <Element 'PubmedArticle' at 0x000002BF3C5CEE00>}, {'pubmed_id': '10997866', 'title': 'Cortical activation during retrieval of arithmetical facts and actual calculation: a functional magnetic resonance imaging study.', 'abstract': 'By using functional magnetic resonance imaging (fMRI), the neural substrates involved in mental recitation of the single-digit multiplication table and serial subtraction were studied. The former depends mostly on well-learned arithmetical facts, while the latter requires arithmetic processing. Activation during each task was compared with that in a number counting control. During the recitation of single-digit multiplication, the activated regions included the area lying along the left intraparietal sulcus, the premotor and supplementary motor areas, and the posterior portion of the left inferior frontal gyrus. The areas activated during serial subtraction included these areas as well as the bilateral prefrontal and right parietal areas. From the results obtained during retrieval of the multiplication table in this study and previous studies, it was concluded that semantic memory of the multiplication table is stored in the area lying along the intraparietal sulcus and that the frontal areas play an executive role in utilizing the semantic memory of arithmetical facts. It was assumed that the arithmetical facts requiring actual calculation are also stored in the same region. The additional activation during serial subtraction compared with the activation during retrieval of the multiplication table is probably due to the processes of actual calculation. These processes include proper alignment of digits, which may have caused the right parietal activation, and maintaining digits needed for the mental serial subtractions, which may have caused the bilateral prefrontal activation.', 'keywords': [], 'journal': 'Psychiatry and clinical neurosciences', 'publication_date': datetime.date(2000, 9, 21), 'authors': [{'lastname': 'Kazui', 'firstname': 'H', 'initials': 'H', 'affiliation': 'Department of Clinical Neurosciences, Hyogo Institute forAging Brain and Cognitive Disorders, Himeji, Japan. kazui@hiabcd.go.jp'}, {'lastname': 'Kitagaki', 'firstname': 'H', 'initials': 'H', 'affiliation': None}, {'lastname': 'Mori', 'firstname': 'E', 'initials': 'E', 'affiliation': None}], 'methods': None, 'conclusions': None, 'results': None, 'copyrights': None, 'doi': '10.1046/j.1440-1819.2000.00739.x', 'xml': <Element 'PubmedArticle' at 0x000002BF3C5D71D0>}]"
My Town : Best Friends' House games for kids,food,[]
